{"id":"ad055055-b9df-4f2c-b9ad-bbd2f93a8687","name":"正面 身体 中间 / 16","nodes":[{"id":"2bd2fc05-5351-4bc6-af8f-89edd5fada77","xMm":-250,"yMm":850},{"id":"88199faf-1816-46d7-8cf6-14c7c7163ae4","xMm":66.75392670157062,"yMm":850},{"id":"924726a4-a521-41ef-a719-aab9cc0709b7","xMm":61.5183246073298,"yMm":815.1282051282053},{"id":"8e2563a3-6370-4550-9601-b61a6bfdd301","xMm":71.98952879581154,"yMm":810.769230769231},{"id":"f5ba08a2-ed40-456d-9734-73a4c51c936e","xMm":71.98952879581154,"yMm":802.0512820512822},{"id":"d839cab9-fe41-4151-a288-bbf31515d78f","xMm":66.75392670157062,"yMm":797.6923076923078},{"id":"bba2bbd0-6d28-47fd-98cd-ae95fdab0160","xMm":71.98952879581154,"yMm":784.6153846153848},{"id":"a2d3b807-dba7-4637-89e0-f644b612270b","xMm":53.66492146596853,"yMm":754.1025641025644},{"id":"c4470b85-1ba6-45d9-a506-74fc6c08b37b","xMm":53.66492146596853,"yMm":727.948717948718},{"id":"76f39699-0dc2-4c20-ad0e-5c9d471d5182","xMm":56.282722513088984,"yMm":727.948717948718},{"id":"a7e27123-9f7c-4f3f-a657-ea523840b00f","xMm":53.66492146596853,"yMm":719.2307692307693},{"id":"f85c41f9-3795-46bc-ac68-4a9d47b066c1","xMm":45.811518324607256,"yMm":723.5897435897436},{"id":"fdeac6dd-de40-42a6-a780-ddeba0d3f4e3","xMm":45.811518324607256,"yMm":736.6666666666667},{"id":"8fbb4964-936f-406e-9fc0-477b127a9f16","xMm":40.57591623036644,"yMm":745.3846153846155},{"id":"1cce84d8-ed50-4450-8ec1-c801c9689fdc","xMm":35.34031413612563,"yMm":771.5384615384618},{"id":"7b6847c1-07ae-433b-b82c-cc6fe1d0a240","xMm":30.10471204188481,"yMm":771.5384615384618},{"id":"7829b790-e9d3-48e1-bb6c-829e9d016734","xMm":17.01570680628272,"yMm":793.3333333333335},{"id":"996c2d65-b56f-41c1-a7d1-d7472008c247","xMm":-1.3089005235601827,"yMm":797.6923076923078},{"id":"c40f44d9-0063-4fa7-ba4a-8c448f2e17f3","xMm":-1.3089005235601827,"yMm":788.9743589743591},{"id":"8ab53258-d051-4423-b853-b6c1f84eec40","xMm":6.544502617800984,"yMm":775.8974358974361},{"id":"ed649873-6009-4c0b-b613-47e80574f347","xMm":6.544502617800984,"yMm":762.820512820513},{"id":"dbcc4e31-27a3-4aba-a955-f311b760103f","xMm":-3.926701570680649,"yMm":767.1794871794874},{"id":"7f0996e2-eb2a-4af1-9632-23a8894ead70","xMm":-9.162303664921462,"yMm":775.8974358974361},{"id":"d049cad8-57de-412a-85af-1715dc3cdf96","xMm":-24.869109947644006,"yMm":771.5384615384618},{"id":"72a4fdee-0ea2-4be8-85ae-9dbafd038b5a","xMm":-27.486910994764422,"yMm":767.1794871794874},{"id":"6d0f52b9-d829-4483-99ab-f989e3885e7c","xMm":-27.486910994764422,"yMm":741.0256410256411},{"id":"62c66412-4a08-4bcc-8007-5089f10d6cc2","xMm":-30.104712041884817,"yMm":741.0256410256411},{"id":"95880abc-5f19-49d2-947a-b0c8168b0bec","xMm":-30.104712041884817,"yMm":727.948717948718},{"id":"b750aeda-909a-44b1-b047-45343fe24c58","xMm":-32.722513089005226,"yMm":727.948717948718},{"id":"907c9995-44b8-4ad9-b88d-3cda3b40e850","xMm":-32.722513089005226,"yMm":710.5128205128206},{"id":"bddc41cd-656a-4472-a581-61488cff0a27","xMm":-37.95811518324609,"yMm":706.1538461538462},{"id":"d9f72043-5eb9-4898-a5bf-072ad0101743","xMm":-35.34031413612569,"yMm":666.9230769230771},{"id":"39ee7ebe-53c9-41fe-8504-dc33032aa2af","xMm":-37.95811518324609,"yMm":666.9230769230771},{"id":"27809858-5d33-46f0-8a59-f6ba5b09126d","xMm":-37.95811518324609,"yMm":649.4871794871797},{"id":"25523863-724d-45be-8cdb-8212999dcbad","xMm":-43.193717277486925,"yMm":645.1282051282053},{"id":"b6796d9f-55a2-4d52-acad-f9a4717be751","xMm":-43.193717277486925,"yMm":632.0512820512823},{"id":"5ef5a5b8-1ba0-412a-9ab5-f722910365be","xMm":-45.81151832460731,"yMm":632.0512820512823},{"id":"eb27a9d8-c0bb-4c4a-9874-ec3877b6ff6d","xMm":-45.81151832460731,"yMm":592.8205128205129},{"id":"63f5dd2b-fbe7-4ab3-a85b-3f453c7cce4a","xMm":-48.42931937172778,"yMm":592.8205128205129},{"id":"767fe3d7-caed-4d57-af11-dd6ee79bd8f3","xMm":-48.42931937172778,"yMm":501.2820512820514},{"id":"53b33d43-df36-4cee-bc73-b4e792bd0224","xMm":-45.81151832460731,"yMm":501.2820512820514},{"id":"d1a6449e-ac5c-4716-b0b8-712402a6e71b","xMm":-43.193717277486925,"yMm":483.846153846154},{"id":"e814ae5c-dc61-4fab-a87b-c75a5a307787","xMm":-40.5759162303665,"yMm":483.846153846154},{"id":"96d69063-1e4f-4fdf-9be7-aaa808120703","xMm":-40.5759162303665,"yMm":466.41025641025647},{"id":"1a3ef77d-c014-4b65-b7fc-bce2753ce17e","xMm":-37.95811518324609,"yMm":466.41025641025647},{"id":"bb4cf139-2d91-4783-b3ee-d0ca832ee500","xMm":-37.95811518324609,"yMm":422.82051282051293},{"id":"2d5f401c-d92b-43b0-9d78-fdf4834db7ab","xMm":-43.193717277486925,"yMm":422.82051282051293},{"id":"930489b5-b3ce-46d5-bf3c-616af9d18ee3","xMm":-40.5759162303665,"yMm":387.948717948718},{"id":"0b81c043-948d-4cee-82e3-e4bd2a246a59","xMm":-45.81151832460731,"yMm":383.58974358974365},{"id":"9e023377-b26f-4279-9811-d81c867b6f6c","xMm":-45.81151832460731,"yMm":344.35897435897436},{"id":"e85bee1b-1225-4f3f-bbd1-f727d3eb222d","xMm":-56.282722513089,"yMm":331.2820512820513},{"id":"fc988191-d56d-40e4-8ced-816985aeeba2","xMm":-58.90052356020942,"yMm":313.8461538461539},{"id":"52beec5a-c6e5-40ff-ba52-0a44fbbde34e","xMm":-64.13612565445028,"yMm":313.8461538461539},{"id":"9dc344f8-55ad-4609-ac00-f01406fa3d31","xMm":-77.22513089005237,"yMm":292.05128205128204},{"id":"89aea58c-6343-44b1-a908-608886e653b0","xMm":-79.84293193717276,"yMm":274.61538461538464},{"id":"3e3c8cc4-52d1-475d-9cfe-a0805f72bc46","xMm":-90.31413612565446,"yMm":261.5384615384616},{"id":"18865f8f-a558-4cbc-9831-4828d8c9d191","xMm":-92.93193717277488,"yMm":244.1025641025642},{"id":"13b9c813-2bd8-44c4-974d-feabb5553456","xMm":-98.16753926701573,"yMm":239.74358974358972},{"id":"1439695e-1063-4244-b97b-8e541dd22237","xMm":-95.54973821989526,"yMm":161.28205128205127},{"id":"6cad8c1d-6796-4355-8e7e-53ffe6e4fee1","xMm":-90.31413612565446,"yMm":152.5641025641026},{"id":"0bd2c3bb-8c67-43f8-890a-db51956fad67","xMm":-90.31413612565446,"yMm":122.05128205128216},{"id":"3580f624-c654-44a6-a5f8-9c708d0cc645","xMm":-87.69633507853405,"yMm":122.05128205128216},{"id":"d7ef5851-8d20-470a-9e72-2b66ace9519b","xMm":-87.69633507853405,"yMm":104.61538461538458},{"id":"5d14508c-084e-4f6d-aa1f-5b5f6cb3c4d1","xMm":-85.07853403141364,"yMm":104.61538461538458},{"id":"ae9ae710-2569-497d-b77a-5f99316eb5d5","xMm":-82.46073298429317,"yMm":65.38461538461547},{"id":"a0942934-2053-4f50-886d-c4e09fa5283a","xMm":-79.84293193717276,"yMm":65.38461538461547},{"id":"4a3e0fd0-4ddd-4ccd-bd5e-50dfc3e7bdd7","xMm":-79.84293193717276,"yMm":52.307692307692264},{"id":"4023b476-114d-478a-ad6d-b11fc5384335","xMm":-77.22513089005237,"yMm":52.307692307692264},{"id":"1ba5c3ce-2d31-4e47-97b1-d97db53abd7d","xMm":-77.22513089005237,"yMm":30.512820512820497},{"id":"867c3e02-7a7d-42c7-8bf7-cdf444cfa32d","xMm":-69.37172774869111,"yMm":17.43589743589746},{"id":"d4167d59-a236-41b0-8867-de13c8cd1fa6","xMm":-66.75392670157068,"yMm":5.684341886080802e-14},{"id":"d98c4c4d-d4e5-4211-b0ff-cf4845a54fea","xMm":-176.70157068062827,"yMm":5.684341886080802e-14},{"id":"f58341f0-36d4-4728-b6b3-39b9e31fd760","xMm":-176.70157068062827,"yMm":52.307692307692264},{"id":"875441c7-1ced-46fb-b7c7-943724993bb1","xMm":-192.40837696335075,"yMm":52.307692307692264},{"id":"fe5562f6-fc2d-437f-96b5-d1305ad0cdab","xMm":-195.02617801047117,"yMm":56.66666666666663},{"id":"0e10e082-b3be-4650-b335-e9fc0bb23be2","xMm":-200.26178010471202,"yMm":165.64102564102564},{"id":"067fca84-c7d0-4167-8ec5-1c03ec0399da","xMm":-202.87958115183244,"yMm":165.64102564102564},{"id":"d1c3a4dc-5470-4ee5-ad4c-2aca92ed6217","xMm":-202.87958115183244,"yMm":200.51282051282058},{"id":"8f7a3152-ea02-43df-a17b-1c8547cf5fba","xMm":-205.49738219895286,"yMm":200.51282051282058},{"id":"a50473d1-0598-4aa0-bba6-21e925ee0b21","xMm":-205.49738219895286,"yMm":239.74358974358972},{"id":"dd9c9c30-95a8-4d72-917f-e813de6ba878","xMm":-208.11518324607326,"yMm":239.74358974358972},{"id":"a69350b0-928a-4e72-b7e2-5b4c20507ece","xMm":-208.11518324607326,"yMm":274.61538461538464},{"id":"e56f208d-1ebe-422c-8966-cfc78e07d94c","xMm":-210.73298429319374,"yMm":274.61538461538464},{"id":"98972ce2-e7a3-4bdc-9bfb-c293ef482d20","xMm":-210.73298429319374,"yMm":313.8461538461539},{"id":"277190fd-faf4-4402-a63d-701843bfbf34","xMm":-213.35078534031416,"yMm":313.8461538461539},{"id":"1b981615-f0ad-4960-a8cd-25754b9fe311","xMm":-213.35078534031416,"yMm":348.71794871794873},{"id":"bf6365c3-6cb0-41ab-9b87-2b7e0a99b3af","xMm":-215.96858638743453,"yMm":348.71794871794873},{"id":"8832b1d2-ae73-44bc-a491-2fb35e04c491","xMm":-215.96858638743453,"yMm":387.948717948718},{"id":"58c02e3b-fbaf-4b33-86c8-8682aff6517e","xMm":-218.58638743455498,"yMm":387.948717948718},{"id":"a7e8436e-bb59-4953-b4ba-69b00481fc8f","xMm":-218.58638743455498,"yMm":422.82051282051293},{"id":"c5507c45-8d6f-4a59-bc72-2418ee81e841","xMm":-221.2041884816754,"yMm":422.82051282051293},{"id":"76565017-dec5-4ecc-9d31-1246f8e1b060","xMm":-221.2041884816754,"yMm":462.0512820512821},{"id":"cfe2e7ce-2ed3-4026-8fb5-3c178852b7a5","xMm":-223.82198952879583,"yMm":462.0512820512821},{"id":"dacfa570-ff76-4812-9a24-30b89811882a","xMm":-223.82198952879583,"yMm":483.846153846154},{"id":"357d357b-a1c2-4349-94c0-27eba1ded89a","xMm":-221.2041884816754,"yMm":483.846153846154},{"id":"99c1529e-83ec-4927-b6e3-964b78b1badd","xMm":-221.2041884816754,"yMm":496.923076923077},{"id":"ec66614a-4d7b-4a5d-9653-4e885b638d52","xMm":-215.96858638743453,"yMm":505.64102564102575},{"id":"562e73de-b454-4d80-b354-1532e3f7dc94","xMm":-215.96858638743453,"yMm":518.7179487179487},{"id":"c948da00-8e28-48fa-8c1c-b67c59364155","xMm":-210.73298429319374,"yMm":527.4358974358975},{"id":"17e159d4-97ef-4c99-93e4-6ae68aeb53be","xMm":-210.73298429319374,"yMm":536.1538461538462},{"id":"8fa564cd-baaa-4b26-bfd9-b82a9f4eede7","xMm":-208.11518324607326,"yMm":536.1538461538462},{"id":"c9ddecfc-b2ad-4b70-be0b-3c5bc269595f","xMm":-205.49738219895286,"yMm":562.3076923076924},{"id":"73c4e05c-f329-4d7c-be5b-8b14d05c6705","xMm":-210.73298429319374,"yMm":566.6666666666667},{"id":"c039b1d4-2123-411e-b072-03d622c8f6e4","xMm":-210.73298429319374,"yMm":592.8205128205129},{"id":"bbe67e99-8648-4f62-9f47-ef1b1c2